id,label,left_title,left_category,left_brand,left_modelno,left_price,right_title,right_category,right_brand,right_modelno,right_price
3618,0,western digital elements 500gb portable se portable hard drive black western digital wdbabv5000abk-nesn 71.98,hard drives,,,,western digital wd elements 3 tb usb 2.0 external hard drive external hard drives wdbaau0030hbk-nesn,,western digital,,119.99
2416,0,microsoft arc touch mouse mice rvf-00001,,microsoft,,57.88,microsoft arc mouse - black 33.46,mice,microsoft,zja-00001,
3024,0,canon mp41dhii printing calculator canon mp41dhii,stationery & office machinery,,,70.88,casio hr-100tm 2-color printing calculator hr100tm 19.99,printing,casio,,
1839,0,d-link dgs-1005g 5-port gigabit desktop switch,networking,d-link,dgs1005g,27.88,d-link dgs-1008g 8-port gigabit desktop switch hubs d-link dgs-1008g,,,,36.98
49,0,snapshield p2 polycarbonate case ipad 2 smoke mp3 accessories scosche ipd2pcbk,,,,20.88,scosche snapshield p2 polycarbonate case ipad 2 - purple ipd2pcpu ipd2pcpu 14.09,laptop netbook computer accessories,scosche,,
2718,0,da-lite video spectra 1.5 model b manual screen - 84 x 84 av format electronics - general 139.99,,da-lite,83225,,da-lite model c with csr - projection screen - 1 1 - video spectra 1.5 with csr,projection screens,da-lite,,401.95
1911,0,edge 1gb pc2-4200 ddr2 533mhz 240-pin desktop memory module memory edge,,,pe197711,18.82,crucial 1gb 240-pin dimm ddr2 pc2-5300 memory module memory crucial,,,ct12864aa667,14.99
3459,0,ep 2gb usb 2.0 capless wave flash drive pink epclp/2gb -2.0 8.84,usb drives,ep memory,,,ep memory 32 gb usb 2.0 capless wave flash drive ep memoryclw 32gb-2 .0 white,usb flash drives,ep memory,epclw/32gb -2.0,53.77
4700,0,optoma bl-fp200c replacement projector lamp for hd70 home theater projector,monitors,optoma,bl-fp200c,264.84,optoma bl-fp230c replacement projector lamp bulb with housing - high quality replacement lamp,lamps,shopforbattery,,182.99
2514,0,panasonic kx-tg4022n dect 6.0 plus expandable cordless answering system w 2 handsets panasonic kx-tg4022n 44.98,electronics - general,,,,panasonic dect 6.0 series 4 handset cordless phone system with answering system kx-tg1034s cordless telephones panasonic kx-tg1034s,,,,
4293,0,da-lite hc matte white advantage manual with csr - wide format 164 diagonal da-lite,electronics - general,,34723,1223.99,hc matte white advantage deluxe electrol - wide format size wide 94 diagonal da-lite,projection screens,,,
5238,0,pny 4gb sdhc memory card class 4 pny p-sdhc4g4-ef 8.98,usb drives,,,,8gb edge proshot sdhc memory card class6 hard drive enclosures edgdm-209797-pe,,edge,,12.4
4832,0,logitech wireless mouse m315 silver mice logitech,,,910002537,19.88,logitech m305 wireless mouse silver mice logitech 910-000928 19.99,,,,
343,0,tp-link tl-ant2409b 2.4 ghz 9dbi outdoor directional antenna tp link tl-ant2409b 27.88,networking,,,,tp-link tl-ant2405c 2.4 ghz 5dbi indoor desktop omni-directional antenna networking products tp-link 4.49,,,tl-ant2405c,
3049,0,ihome wireless optical mouse black 25.56,mice,ihome,ih-m821wb,,2.4 ghz wireless optical nano mouse black usb mp2375blk,mice,gear head,,12.0
163,0,incipio ipod touch 4g silicrylic hard shell case with silicone core all black mp3 accessories 28.5,,incipio,ip-904,,incipio ip-919 edge hard case for ipod touch 4g - black ip-919,cases,incipio,,
3088,0,da-lite matte white advantage manual with csr - hdtv format 159 diagonal 1080.63,electronics - general,da-lite,85743,,da-lite advantage manual with csr - projection screen - 1 1 - high power projection screens da-lite,,,,
21,0,elite screens cinegray prime vision series fixed frame screen - 135 diagonal elite screens 1069.0,electronics - general,,pvr135h1,,powergain prime vision series fixed frame screen - 120 diagonal projection screens elite 929.0,,,,
1799,0,ep 16gb usb 2.0 mobile swingdrive flash drive usb drives epsw/16gb -2.0,,ep memory,,29.84,acp-ep memory usbpd 8gb-2 .0 8gb usb 2.0 mobile vault privacy flash drive usb flash drives usbpd/8gb -2.0 17.23,,acp,,
5396,0,da-lite da-plex self trimming rear projection screen - 60 x 60 av format electronics - general 27575 2680.99,,da-lite,,,da-plex base rear projection screen - 43 1 4 x 57 3 4 video format da-lite,projection screens,,,1669.99
1660,0,north carolina tar heels pro grip mouse msu045,mice,team pro mark,,26.99,north carolina tar heels iphone 4 case silicone cover tribeca 19.99,computers accessories,,,
4878,0,panasonic lumix dmc-fh5v 16.1 mp violet digital camera w 4x optical zoom 2.7 lcd display digital cameras panasonic dmc-fh5v 129.0,,panasonic,,,panasonic lumix dmc-fp5 14.1 mp digital camera with 4x optical image stabilized zoom with 3.0-inch touch-screen lcd pink panasonic,point shoot digital cameras,,dmc-fp5p-p,129.95
4366,0,brother tx2511 laminated tape cartridge stationery & office machinery brother,,,tx2511,34.88,brother tz641 laminated tape cartridge brother,labeling tapes,,,15.09
2534,0,msi ati radeon hd6670 1gb ddr5 pci-express video card msi r6670-md1gd5 107.0,electronics - general,,,,sapphire radeon hd5750 1gb ddr5 dvi hdmi displayport pci-express video card 100284-2l 100284-2l 109.99,,sapphire,,
1080,0,hp ce278a black laserjet print cartridge hp 69.84,printers,,hp ce278a,,okidata laserjet printer toner cartridge black laser printer toner,,oki data,42102801,144.4
3961,0,hp 901 black inkjet cartridge twin pack 26.98,printers,hp,hp cz075fn # 140,,hp 20 black ink cartridge in retail packaging 27.52,inkjet printer ink,hp,c6614d,
2896,0,brother tn360 black toner cartridge brother tn360,printers,,,45.54,brother toner cartridge tn570 laser printer toner brother tn570,,,,65.85
2565,0,mukii tip-pu301cb 2-port usb 3.0 expresscard electronics - general tip-pu301cb,,mukii,,32.0,mukii transimp tip-pu301 usb 3.0 2 port pci-e host card mukii,usb port cards,,tip-pu301,27.99
5571,0,smead file folders 1 2 cut 1-ply top tab manila 100 box stationery & office machinery 34.05,,,15320,,pendaflex 421013 - interior file folders 1 3 cut top tab letter manila 100 box home audio theater pendaflex,,,,
2989,0,apple ipod shuffle 4gb pink 4th gen ipod apple mc331ll/a 73.54,,,,,apple ipod shuffle 2 gb blue 4th generation newest model mc751ll/a,mp3 players,apple,,46.99
4162,0,da-lite da-glas standard rear projection screen 81 x 108 video format da-lite 27917 5391.99,electronics - general,,,,holoscreen rear projection screen - 66 x 101 video format projection screens da-lite,,,,7400.0
743,0,fellowes 91441 gel crystal mouse pad with wrist rest electronics - general fellowes 91441 14.88,,,,,hello kitty black purple mouse pad with wrist rest,mouse pads,hello kitty,74709k,14.99
4851,0,pendaflex cutless watershed file folders 1 3 cut top tab letter manila 100 per box stationery & office machinery 22.69,,,48434,,new-smead 10343 - watershed cutless file folders 1 3 cut top tab letter manila 100 box - smd10343 37.0,laminating supplies,smead,,
2053,0,hp 29 black inkjet cartridge 51629a hp 51629a,printers,,,34.97,hp oem 94 c8765wn black inkjet cartridge,inkjet printer ink,hp,,12.17
2375,0,da-lite da-plex thru-the-wall rear projection screen - 78 x 139 hdtv format 23077,electronics - general,da-lite,,11385.99,da-lite da-plex thru-the-wall rear projection screen - 72 x 96 video format projection screens da-lite 10252.0,,,23049,
5554,0,clickfree c2 500gb usb 3.0 portable external hard drive clickfree,hard drives,,hd527b3,84.98,iosafe rugged portable 1 tb usb 3.0 external hard drive pa51000u1yr,external hard drives,iosafe,pa51000u1yr,284.99
359,0,brother tn110bk black toner cartridge printers,,brother,tn110bk,49.88,brother tn550 3 500 yld standard yield toner cartridge laser printer toner brother tn550,,,,47.49
5422,0,da-lite da-glas standard rear projection screen 81 x 108 video format da-lite 27917 5391.99,electronics - general,,,,da-lite 27512 da-plex unframed rear projection screen - 72 x 96 video format projection screens,,da-lite,,
901,0,logitech wireless mouse m310 bundle computers,,,,29.88,logitech wireless mouse m215 mice logitech 910-001543,,,,18.49
5601,0,epson t008201 color ink cartridge for stylus color 780870875 dc 875dcs and 890 printers 20.84,,epson,t008201,,ld epson t029201 t029 color remanufactured ink cartridge for stylus c60 7.95,inkjet printer ink,4inkjets,,
4539,0,innovera d2130b black compatible high-yield toner print cartridge 58.9,printers,innovera,d2130b,,innovera 106 - 106 compatible toner 5000 page-yield black innovera,storage presentation materials,,,
910,0,da-lite da-plex deluxe rear projection screen - 58 x 104 hdtv format electronics - general,,da-lite,27571,4629.99,da-plex base rear projection screen - 43 1 4 x 57 3 4 video format da-lite,projection screens,,,1669.99
5782,0,da-lite dual vision tensioned advantage deluxe electrol - hdtv format 92 diagonal electronics - general da-lite,,,88285,4242.99,da-lite tensioned advantage deluxe electrol - projection screen motorized - 92 in - 16 9 - high contrast cinema vision da-lite 2959.95,projection screens,,,
4145,0,iosafe rugged 750gb usb 3.0 portable external hard drive,hard drives,iosafe,pa70750u1yr,139.98,iomega ego helium 1 tb usb 2.0 portable external hard drive 34820 silver computers accessories iomega,,,34820,124.99
2368,0,siig 1m mini displayport to display port adapter cable electronics - general 12.88,,siig,cb-dp0d11-s1,,display port to hdmi adapter vga m f cable siig 9.49,,,cb-dp0062-s1,
2123,0,da-lite da-view thru-the-wall rear projection screen - 60 x 80 video format 23046 13997.99,electronics - general,da-lite,,,da-lite 27651 da-glas deluxe rear projection screen - 96 x 96 av format,projection screens,da-lite,,
1858,0,vantec nexstar3 superspeed 2.5 sata to usb 3.0 external hard drive enclosure,electronics - general,vantec,nst-280s3-bk,26.62,superspeed usb 3.0 to sata 3gb s 2.5 in drive enclosure 29.89,cables interconnects,siig,ju-sa0312-s1,
125,0,da-lite da-glas deluxe rear projection screen - 40 1 4 x 53 3 4 video format da-lite 27655 1752.99,electronics - general,,,,da-lite data pro thru-the-wall rear projection screen - 52 x 92 hdtv format da-lite 15985.81,projection screens,,23181,
5660,0,philips 3 high speed hdmi cable electronics - general philips 10.43,,,swv3431w/17,,philips pro series sww1433u 27 high speed hdmi cable with ethernet 4 feet hdmi cables philips,,,sww1433u/27,19.99
250,0,imation 43347 dds-2 data cartridge mp3 accessories imation 10.88,,,43347,,qic data cartridge 53.39,data cartridges,imation,,
1981,0,ocz technology vertex 2 60gb 2.5 sata ii solid state drive ocz technologies 119.98,hard drives,,oczssd22vtxe60g,,ocz technology 120 gb vertex 2 series sata ii 2.5-inch solid state drive ssd oczssd2-2vtxe120g 159.99,computer components,ocz,oczssd2-2vtxe120g,
3308,0,elite electric100h screens spectrum electrol projection screen electronics - general,,elite screens,electric100h,160.0,elite screens vmax2 electric projection screen 1 1 aspect ratio-113in max white projection screens elite screens,,,vmax113xws2,356.99
3087,0,v7 10 cat6 snagless molded network patch cable gray electronics - general,,v7,v7n2c6-10f-grys,5.88,v7 cat6 snagless molded network patch cable rj45 male to male red 3-feet v7n2c6-03f-reds v7n2c6-03f-reds,ethernet cables,v7,,2.27
3243,0,logitech wireless mouse dark fleur 910001898,mice,logitech,,27.82,logitech wireless keyboard k250 dark fleur 920-002825 23.25,keyboards,logitech,,
1558,0,sony 62mm front lens cap photography - general 9.0,,sony,alc-f62a,,dslr front lens cap 8.99,lens accessories,sony,alc-f49a,
4848,0,elite screens 92 vmax92uwv2 electric projection screen vmax92uwv2,electronics - general,elite,,319.59,elite screens vmax2 electric projection screen 1 1 aspect ratio-99in max white projection screens 327.24,,elite,vmax99uws,
185,0,microsoft wireless mobile mouse 4000 sgkomen pink microsoft,mice,,d5d-00052,20.0,microsoft wireless mobile mouse 6000 - purple mice mhc-00023 20.95,,microsoft,,
810,0,philips 3 high speed hdmi cable electronics - general philips 10.43,,,swv3431w/17,,bell o hd7101 high speed hdmi cables hdmi cables hd7101 31.97,,bell ' o,,
1635,0,hello kitty sms text messenger toys - games sakar 79009,,,,19.11,hello kitty 79009 sms text messenger red audio video accessories hello kitty 79009-tru-red 16.99,,,,
4179,0,vtech ds6151 2-line expandable cordless phone with digital answering system caller id electronics - general 62.51,,vtech,ds6151,,panasonic dect 6.0 expandable cordless phone with talking caller id answering system - 4 handset pack cordless telephones panasonic 132.68,,,,
5900,0,griffin ipod touch 4g screen care kit 3 pack arkon gb01913 13.3,mp3 accessories,,,,griffin gb01717 iphone 4 matte screen care kit 3 pk,computers accessories,griffin technology,,
613,0,epson t068120-d2 dual black ink cartridge printers epson epson t068120-d2,,,,39.84,epson t017-18 black color ink cartridge dual pack t017201-bcd,inkjet printer ink,epson,,56.99
2404,0,belkin basic wireless n150 usb adapter networking f7d1101,,belkin,,29.99,linksys wireless network usb adapter usb network adapters cisco wusb100,,,,33.45
1268,0,hon 310 series full-suspension file,storage,hon,315cpp,549.0,hon 214pl - 210 series four-drawer full-suspension file letter 28-1 2d putty,antitheft,hon,,
2767,0,epson t020201 color ink cartridge epson t020201 27.0,printers,,,,epson t048920 color ink cartridge multipack inkjet printer ink t048920 52.44,,epson,,
2779,0,viewsonic 22 widescreen led-lcd monitor black va2248m-led va2248m-led,monitors,viewsonic,,155.0,viewsonic va1931wa 19-inch widescreen lcd monitor 99.99,monitors,viewsonic,va1931wa,
1629,0,logitech wireless mouse m315 silver mice logitech,,,910002537,19.88,logitech wireless performance mouse mx for pc and mac logitech 79.95,mice,,910-001105,
2519,0,da-lite da-glas deluxe rear projection screen - 40 1 4 x 53 3 4 video format da-lite 27655 1752.99,electronics - general,,,,da-lite 27903 da-plex self trimming rear projection screen - 96 x 120 av format da-lite,projection screens,,,
2119,0,kingston 1gb ddr pc-3200 400mhz ddr 184 pin desktop memory module memory kingston,,,kvr400x64c3a1g,50.92,corsair memory vs1gb400c3 1 gb pc-3200 400mhz 184-pin ddr desktop memory 24.99,memory,corsair,vs1gb400c3,
6142,0,crown industrial deck plate antifatigue vinyl mat 36 x 144 black yellow border home care 379.97,,crown,,,new-crown cd0035db - industrial deck plate antifatigue mat vinyl 36 x 60 black - cwncd0035db laminating supplies,,crown,,179.0
1964,0,pc treasures wireless optical mouse 2.4 ghz purple 07227,mice,pc treasures,,17.82,2.4 ghz wireless optical tilt wheel mouse black,mice,gear head,mpt3300blk,19.5
1245,0,hp ce278a black laserjet print cartridge hp 69.84,printers,,hp ce278a,,hp laserjet 12a black print cartridge in retail packaging inkjet printer ink,,hp,q2612a,56.18
4454,0,seagate barracuda 500gb internal hard drive seagate,hard drives,,st3500413as,44.99,diskgo 500gb external hard drive edgdg207342pe,,edge,,121.01
4367,0,da-lite dual vision tensioned advantage deluxe electrol - hdtv format 92 diagonal electronics - general da-lite,,,88285,4242.99,da-tex rear tensioned advantage electrol - wide format size wide 94 diagonal da-lite,projection screens,,,
2350,0,da-lite da-plex self trimming rear projection screen - 58 x 104 hdtv format da-lite 27590,electronics - general,,,4635.99,da-lite da-glas thru-the-wall rear projection screen - 90 x 120 video format 8729.48,projection screens,da-lite,23056,
5055,0,startech 3.5 external usb ide hard drive enclosure black startech 28.88,electronics - general,,ide3510u2,,vantec nexstar cx nst-300su-bk 3.5-inch sata to usb 2.0 and esata external hard drive enclosure black hard drive enclosures,,vantec,nst-300su-bk,22.99
224,0,panasonic lumix dmc-fh5v 16.1 mp violet digital camera w 4x optical zoom 2.7 lcd display digital cameras panasonic dmc-fh5v 129.0,,panasonic,,,panasonic lumix dmc-fh3 14.1 mp digital camera with 5x optical image stabilized zoom and 2.7-inch lcd black point shoot digital cameras panasonic dmc-fh3k,,,,129.47
3926,0,da-lite matte white designer model b with fabric case in fawn - 70 x 70 av format da-lite 73113,electronics - general,,,152.99,video spectra 1.5 designer model b with fabric case in fawn - av format size 50 x 50,projection screens,da-lite,,
2682,0,hp ce250a black toner cartridge ce250a,printers,hp,,187.04,c54x x543 x544 return prog black toner cartridge lexmark c540a1kg 40.0,laser printer toner,,,
3663,0,innovera m4640 compatible remanufactured high-yield ink 484 page-yield black printers innovera,,,m4640,24.99,new-innovera 86430 - 86430 compatible remanufactured high-yield toner 12000 page-yield black - ivr86430 computer accessories innovera 241.0,,,,
770,0,corsair xms2 2gb 2 x 1gb pc2-6400 800mhz 240-pin ddr2 cl5 dual channel desktop memory kit - twin2x4096-6400c5c memory corsair twin2x4096-6400c5c 72.82,,,,,corsair cm2x2048-6400c5 xms2 2gb pc2-6400 800mhz 240-pin ddr2 cl5 desktop memory module corsair cm2x2048-6400c5 29.7,memory,,,
4630,0,microsoft wireless mobile mouse 4000 sgkomen pink microsoft,mice,,d5d-00052,20.0,microsoft wireless mobile mouse 3500 - moore artist series gmf-00091 microsoft,mice,,gmf-00091,19.99
6071,0,case logic slr camera backpack case logic dcb-309black,mp3 accessories,,,79.99,case logic tbc-306 slr camera holster black cases bags tbc-306black,,case logic,,21.02
262,0,clickfree c2 500gb usb 3.0 portable external hard drive clickfree,hard drives,,hd527b3,84.98,western digital wd elements 500 gb usb 2.0 portable external hard drive 74.99,external hard drives,western digital,wdbaar5000abk-nesn,
5297,0,kingston ktd-dm8400a 1g 1gb ddr2 sdram memory module kingston ktd-dm8400a / 1g 22.92,memory,,,,kingston 1 gb ddr2 sdram memory module 1 gb 333mhz ddr2667 pc25300 ddr2 sdram 200pin sodimm ktd-insp6000b 1g memory ktd-insp6000b / 1g,,kingston,,16.26
3292,0,logitech wireless mouse m310 bundle computers,,,,29.88,logitech mouse m110 black 910-001600,mice,logitech,,13.78
4627,0,da-lite da-plex self trimming rear projection screen - 58 x 104 hdtv format da-lite 27590,electronics - general,,,4635.99,da-lite data pro thru-the-wall rear projection screen - 52 x 92 hdtv format da-lite 15985.81,projection screens,,23181,
5624,0,sylvania sdvd7027 7 portable dvd player black sylvania,dvd players,,sdvd7027-black,59.0,sony dvp-fx750 7-inch portable dvd player black,portable dvd players,sony,dvpfx750,129.0
5767,0,sharpie retractable permanent markers fine point set of 12 black stationery & office machinery sharpie 32701,,,,13.64,sharpie 37074 - permanent markers ultra fine point assorted 4 set storage presentation materials sharpie,,,,22.14
5549,0,da-lite video spectra 1.5 deluxe model b manual screen - 50 x 67 video format 73639 181.99,electronics - general,da-lite,,,da-lite deluxe model b video spectra 1.5 - projection screen - 92 in projection screens,,da-lite,video spectra 1.5,194.95
4120,0,netgear fvs318g-100nas prosafe firewall - 8 x 101001000 base-t lan 1 x 101001000 base-t wan netgear,networking,,fvs318g-100nas,118.0,netgear fvs318 prosafe vpn firewall 8 with 8-port 10 100 switch netgear fvs318na,routers,,,
2630,0,roocase 2 in 1 capacitive stylus ballpoint pen for ipad 2 tablet electronics - general 219943 15.99,,roocase,,,roocase capacitive stylus for apple ipad red roocase ym-capstylus-rd 8.97,touch screen tablet accessories,,,
1218,0,da-lite da-plex deluxe rear projection screen - 36 x 48 video format 27559,electronics - general,da-lite,,1630.99,da-plex base rear projection screen - 43 1 4 x 57 3 4 video format da-lite,projection screens,,,1669.99
3844,0,quantum mr-s2mqn-01 super dlttape ii cartridge mp3 accessories quantum mr-s2mqn-01,,,,94.88,quantum 160 320gb super dlt i tape media data cartridge mr-samcl-01 data cartridges tandberg 432302,,,,43.96
1102,0,xtrememac incharge mobile case for iphone 4 memorex ippim411 79.99,electronics - general,,,,xtrememac ipu-ia3-11 incharge auto aux for iphone ipod ipad memorex 37.78,chargers,,ipu-ia3-11,
4516,0,v7 5 cat6 snagless molded network patch cable red,electronics - general,v7,v7n2c6-05f-reds,4.88,v7 cat5e snagless molded network patch cable rj45 male to male blue 25-feet v7n3c5e-25f-blus ethernet cables v7 v7n3c5e-25f-blus,,,,5.13
5930,0,case logic 16 laptop backpack 154710 39.99,electronics - general,case logic,,,case logic dlbp-114 14-inch laptop backpack red case logic 39.99,bags cases,,dlbp-114red,
3762,0,humminbird 778c hd color fishing system 407930-1 499.46,fishing and boating,humminbird,,,humminbird 407950-1 788ci hd color fishing system,sports outdoor gps,humminbird,,
4906,0,da-lite da-plex thru-the-wall rear projection screen - 78 x 139 hdtv format 23077,electronics - general,da-lite,,11385.99,da-lite da-plex self trimming rear projection screen - 94 1 2 x 168 hdtv format projection screens,,da-lite,27151,9233.33
6118,0,da-lite da-plex deluxe rear projection screen - 78 x 139 hdtv format da-lite 7452.99,electronics - general,,27573,,da-plex standard rear projection screen - 81 x 108 video format projection screens da-lite,,,,5115.0
2784,0,kingston hyperx blu 2gb ddr2 desktop memory module memory 34.72,,kingston,khx6400d2b1/2g,,kingston hyperx 4 gb kit 2x2 gb modules 1066mhz ddr2 dimm desktop memory khx8500d2t1k2 4g computers accessories kingston khx8500d2t1k2/4g 59.99,,,,
5503,0,virginia tech hokies iphone 4 case black shell electronics - general fva3168,,tribeca,,29.99,chicago bulls iphone 4 case black shell,computers accessories,tribeca,,17.99
4996,0,buffalo technology drivestation axis 1.5 tb usb 2.0 desktop external hard drive with buffalo tools and turbo pc hd-lb1 .5 tu2 black buffalo technology hd-lb1 .5 tu2 101.82,hard drives,,,,buffalo technology ministation stealth 640 gb usb 2.0 portable external hard drive hd-pct640u2 b black external hard drives buffalo technology 75.98,,,hd-pct640u2 / b,
5872,0,microsoft wireless laser desktop 3000 keyboard and mouse combo,electronics - general,microsoft,nud-00001,29.82,microsoft wireless keyboard 6000 keyboards j9c-00001 26.37,,microsoft,,
5743,0,razer lycosa gaming keyboard,electronics - general,razer,lycosa,67.84,razer tron gaming keyboard rz03-00530100-r3u1 keyboards rz03-00530100-r3u1,,razer,,129.87
4396,0,ibm 28p2010 black toner cartridge ibm,printers,,28p2010,425.0,brother black toner cartridge tn-210bk laser printer toner 48.99,,brother,tn-210bk,
1148,0,hp q1421a universal semi-gloss photo paper hp 94.88,stationery & office machinery,,q1421a,,hp q1397a universal bond paper hp 66.99,printer accessories,,,
2010,0,da-lite da-glas deluxe rear projection screen - 50 x 50 av format electronics - general 1919.99,,da-lite,27647,,da-lite da-glas thru-the-wall rear projection screen - 78 x 139 hdtv format projection screens 23078,,da-lite,,9044.23
4357,0,da-lite video spectra 1.5 model b manual screen - 84 x 84 av format electronics - general 139.99,,da-lite,83225,,da-lite advantage manual with csr - projection screen - 1 1 - video spectra 1.5 projection screens da-lite,,,,594.95
2566,0,samsill altego 15 neoprene laptop sleeve platinum electronics - general samsill 34.99,,,36031samsill,,samsill microsoft 15.6-inch 16-inch neoprene laptop sleeve black 39511 samsill 23.61,bags cases,,39511,
2381,0,startech esata usb to sata external hard drive docking station for 2.5 hdd satadocku2e 29.84,electronics - general,startech,,,startech esata usb to sata hard drive docking station for dual 2.5 or 3.5-inch hdd satadock22ue startech satadock22ue 48.23,hard drive enclosures,,,
2408,0,hon metal bookcase 34-1 2w x 12-5 8d x 81-1 8h furniture hon s82abcp 369.0,,,,,new-hon s82abcq - metal bookcase 6 shelves 34-1 2w x 12-5 8d x 81-1 8h light gray - hons82abcq 519.0,laminating supplies,hon,,
2584,0,coby 8gb video mp3 player black,mp3,coby,mp727-8gblk,59.88,coby 4 gb video mp3 player with fm radio red mp3 players mp620-4gred 23.15,,coby,,
2666,0,buffalo technology linkstation duo 1 tb 2 x 500 gb network attached storage ls-wx1 .0 tl r1 buffalo technology lswx10tlr1,networking,,,192.63,buffalo technology linkstation pro 1 tb high performance network attached storage ls-v1 .0 tl black computers accessories buffalo technology,,,ls-v1 .0 tl,147.99
5802,0,clickfree c2 500gb usb 3.0 portable external hard drive clickfree,hard drives,,hd527b3,84.98,clickfree automatic backup c2n 1 tb usb 3.0 network ready portable external hard drive 1027n3 piano black computers accessories clickfree 1027n3,,,,119.99
390,0,smead folders front interior pocket straight end tab letter manila 50 box 45.94,stationery & office machinery,,24117,,smead 24109 - folders straight cut reinforced end tab letter manila 100 box smead,,,,
2085,0,kodak easyshare m531 red 14mp digital camera w 3x optical zoom 2.7 lcd display w 50 bonus prints digital cameras m531 red,,kodak,,89.0,kodak easyshare dx6490 4 mp digital camera with 10xoptical zoom point shoot digital cameras 8500282,,kodak,,
3354,0,da-lite da-view thru-the-wall rear projection screen - 60 x 80 video format 23046 13997.99,electronics - general,da-lite,,,da lite data pro thru-the-wall rear projection screen - 45 x 80 hdtv format 23179 11772.99,projection screens,da-lite,,
4238,0,logitech wireless mouse m315 silver mice logitech,,,910002537,19.88,logitech wireless mouse m310 soft violet mice logitech,,,910-001918,23.13
4741,0,ep 16gb usb 2.0 mobile swingdrive flash drive usb drives epsw/16gb -2.0,,ep memory,,29.84,sandisk cruzer blade 16gb usb 2.0 flash drive sandisk 19.87,usb flash drives,,sdcz50-016g,
2376,0,da-lite da-mat deluxe fast fold complete front projection screen - 68 x 68 da-lite 88604 829.99,electronics - general,,,,da-lite 27651 da-glas deluxe rear projection screen - 96 x 96 av format,projection screens,da-lite,,
2890,0,da-lite da-plex self trimming rear projection screen - 96 x 120 av format da-lite 7799.99,electronics - general,,27903,,da-lite holo screen - projection screen rear video projectors da-lite,,,,
