id,label,left_title,left_category,left_brand,left_modelno,left_price,right_title,right_category,right_brand,right_modelno,right_price
1568,0,casio exilim ex-zs5 14.1 mp digital camera silver w 5x optical zoom 2.7 lcd display casio,digital cameras,,,100.0,sanyo blue vpc-t1495bl 14mp digital camera w 5x optical zoom 2.7 lcd display point shoot digital cameras sanyo,,,,69.95
2603,0,kensington pro fit mobile wireless mouse with nano receiver black k72366us mice kensington 23.88,,,,,kensington pro fit 2.4 ghz wireless full-size mouse black k72342us 30.71,mice,kensington,,
4415,0,v7 25 cat5e snagless network patch cable yellow v7 6.88,electronics - general,,v7n3c5e-25f-ylws,,v7 cat5e snagless molded network patch cable rj45 male to male blue 25-feet v7n3c5e-25f-blus ethernet cables v7 v7n3c5e-25f-blus,,,,5.13
3686,0,canon cli-226 black ink tank,printers,canon,,0.0,canon 2950b001 cli-221 ink tank gray inkjet printer ink canon 11.99,,,2950b001,
2031,0,da-lite da-tex rear tensioned advantage electrol - av format 8 x 8 diagonal electronics - general,,da-lite,85375,2549.38,hc cinema perf tensioned advantage electrol - wide format 113 diagonal,projection screens,da-lite,,
1157,0,iosafe rugged 750gb usb 3.0 portable external hard drive,hard drives,iosafe,pa70750u1yr,139.98,lacie rugged all-terrain 1 tb firewire 800 firewire 400 usb 2.0 portable external hard drive 301924 lacie,computers accessories,,301924,199.0
5756,0,da-lite da-plex deluxe rear projection screen - 58 x 104 hdtv format electronics - general,,da-lite,27571,4629.99,da-glas base rear projection screen - 36 x 48 video format da-lite 1199.99,projection screens,,,
4527,0,roocase executive portfolio leather case w 2 screen protector for blackberry playbook electronics - general,,roocase,220761,35.99,roocase executive portfolio black leather case cover with landscape portrait view for blackberry playbook tablet wi-fi 4g cases sleeves 20.0,,roocase,,
2639,0,iosafe rugged 250gb usb 3.0 portable external hard drive iosafe 249.99,hard drives,,pa50250u5yr,,seagate expansion 250 gb usb 2.0 portable external hard drive st902504exa101-rk external hard drives,,seagate,st902504exa101-rk,44.99
4265,0,michigan wolverines iphone 4 case silicone cover electronics - general tribeca 24.99,,,fva3437,,georgia bulldogs iphone 4 case silicone cover tribeca 17.99,computers accessories,,,
5134,0,da-lite da-glas deluxe rear projection screen - 96 x 96 av format 6128.99,electronics - general,da-lite,27651,,da-lite 27565 da-plex deluxe rear projection screen - 72 x 96 video format,,da-lite,,
3922,0,xfx ati radeon 5670 hd pci-express 1gb ddr3 graphics card electronics - general xfx hd567xznl3 91.88,,,,,visiontek ati radeon hd 4670 1 gb ddr3 pci express graphics card 900251 computers accessories visiontek 900251 69.99,,,,
329,0,sharpie retractable permanent markers fine point set of 12 black stationery & office machinery sharpie 32701,,,,13.64,sharpie 35074 - permanent marker extra fine point assorted 4 set microphones accessories 22.34,,sharpie,,
40,0,da-lite da-plex self trimming rear projection screen - 96 x 120 av format da-lite 7799.99,electronics - general,,27903,,da-lite da-glas thru-the-wall rear projection screen - 72 x 96 video format 8968.99,projection screens,da-lite,23050,
5097,0,da-lite da-plex deluxe rear projection screen - 50 1 2 x 67 1 4 video format da-lite,electronics - general,,27562,2544.99,da-lite da-plex standard rear projection screen - 94 1 2 x 168 hdtv format da-lite,projection screens,,27149,7864.0
3140,0,da-lite da-plex standard rear projection screen - 60 x 80 video format electronics - general da-lite 27544 2931.99,,,,,da lite data pro thru-the-wall rear projection screen - 45 x 80 hdtv format 23179 11772.99,projection screens,da-lite,,
3918,0,da-lite da-plex deluxe rear projection screen - 50 1 2 x 67 1 4 video format da-lite,electronics - general,,27562,2544.99,da-plex standard rear projection screen - 96 x 96 av format da-lite 5912.99,projection screens,,,
5311,0,elite screens cinewhite cinetension2 series 64 overall height tension electric motorized screen - 84 diagonal electronics - general elite screens,,,te84vw2,637.0,maxwhite vmax2 plus2 series 116.5 overall height ezelectric motorized screen - 135 diagonal in white case projection screens elite 594.0,,,,
6081,0,da-lite da-plex unframed rear projection screen - 84 x 84 av format 3561.99,electronics - general,da-lite,27503,,da-lite da-plex thru-the-wall rear projection screen - 72 x 96 video format projection screens da-lite 10252.0,,,23049,
2179,0,innovera d3010 black compatible high-yield toner print cartridge stationery & office machinery d3010,,innovera,,68.35,new-innovera d2130b - d2130b compatible high-yield toner 2500 page-yield black - ivrd2130b computer accessories,,innovera,,78.0
1173,0,brother tn450 black toner cartridge high yield toner brother,printers,,tn450,48.88,brother tn250 toner cartridge tn250,laser printer toner,brother,,22.6
6083,0,maccase premium leather 17 macbook pro flight jacket w backpack option electronics - general 155623 191.96,,maccase,,,maccase premium leather ipad ipad2 flight jacket - vintage cases sleeves lpadfj-vn 189.95,,maccase,,
684,0,hp q6511a hp 11a toner 6000 page-yield black 191.03,printers,hp,q6511a,,oki 52111701 - 52111701 toner 1500 page-yield black oki 34.46,accessory kits,,,
296,0,v7 10 cat5e snagless network patch cable blue electronics - general v7n3c5e-10f-blus,,v7,,4.88,belkin cat-5e snagless patch cable blue 25 feet a3l791-25-blu-s,ethernet cables,belkin,,9.5
3665,0,hp 45 black inkjet cartridge 51645a,printers,hp,51645a,35.78,hp oem 94 c8765wn black inkjet cartridge,inkjet printer ink,hp,,12.17
1458,0,da-lite da-glas deluxe rear projection screen - 96 x 96 av format 6128.99,electronics - general,da-lite,27651,,holoscreen rear projection screen - 66 x 101 video format projection screens da-lite,,,,7400.0
4144,0,logitech m315 wireless optical mouse blue mice,,logitech,m315,19.88,logitech wireless mouse m305 dark fleur mice logitech 910-001898 24.17,,,,
4717,0,da-lite da-view thru-the-wall rear projection screen - 60 x 80 video format 23046 13997.99,electronics - general,da-lite,,,da-lite 27578 da-plex self trimming rear projection screen - 96 x 96 av format,projection screens,da-lite,,
1663,0,da-lite da-plex self trimming rear projection screen - 60 x 60 av format electronics - general 27575 2680.99,,da-lite,,,da-lite 27565 da-plex deluxe rear projection screen - 72 x 96 video format,,da-lite,,
5815,0,nikon coolpix s70 brown 12.1 mp digital camera with 5x optical zoom w 50 bonus prints digital cameras nikon s70 brown,,,,299.95,nikon coolpix s3100 14 mp digital camera with 5x nikkor wide-angle optical zoom lens and 2.7-inch lcd blue,point shoot digital cameras,nikon,s3100 blue,
2838,0,da-lite da-glas deluxe rear projection screen - 50 x 50 av format electronics - general 1919.99,,da-lite,27647,,da-plex standard rear projection screen - 81 x 108 video format projection screens da-lite,,,,5115.0
4561,0,hon 10700 series right pedestal credenza 72w x 24d x 29-1 2h mahogany hon,furniture,,10707rnn,799.0,new-hon 107497mm - 10700 series computer credenza 72w x 24d x 29-1 2h medium oak - hon107497mm hon 519.0,laminating supplies,,,
1544,0,maxell color buds earbuds - pink cb-pink maxell 9.88,electronics - general,,cb-pink,,maxell wt-pink wild things earbud pink wt-pink 8.98,headphones,maxell,,
5346,0,kodak 10c color ink cartridge kodak,printers,,10c,19.97,lexmark 18c0035 high yield color ink cartridge printer ink toner lexmark,,,18c0035,
2936,0,kodak easyshare m530 red 12mp digital camera w 3x optical zoom 2.7 lcd w 50 bonus prints digital cameras,,kodak,m530 red,99.54,kodak easyshare m550 12 mp digital camera with 5x wide angle optical zoom and 2.7-inch lcd purple point shoot digital cameras easyshare m550 purple 89.99,,kodak,,
2984,0,da-lite video spectra 1.5 advantage manual with csr - video format 84 diagonal,electronics - general,da-lite,85703,847.99,da-lite manual 92 diagonal hdtv format home theater wall screen with video spectra 1.5 fabric projection screens da-lite 254.95,,,,
4455,0,cyber acoustics computer stereo silver headset microphone electronics - general cyber acoustics ac401,,,,14.84,cyber acoustics ac-744 earclip headset with microphone with pc y-adapter ac-744 10.9,accessories supplies,cyber acoustics,,
1881,0,belkin gold series high-speed usb 2.0 cable 6 ft.,electronics - general,belkin,f3u133v06gld,29.99,belkin f3u133-10 hi-speed usb 2.0 cable 10 feet belkin f3u133-10 4.01,usb cables,,,
5666,0,logitech wireless mouse m315 victorian mice,,logitech,910002534,19.88,logitech wireless mouse m310 red tendrills mice 910-001920 28.51,,logitech,,
3627,0,griffin technology outfit gloss ipod touch 4g black griffin technology gb01967 24.99,mp3 accessories,,,,griffin reveal case for ipod touch 4g black griffin technology,cases,,gb01915,5.99
2485,0,ifrogz pulse case for ipod touch 4 iron and white,electronics - general,ifrogz,it4plsirnwht,29.99,ifrogz luxe lean case for ipod touch 4g gun metal cases ifrogz,,,it4ll-gmt,11.99
3105,0,da-lite da-plex self trimming rear projection screen - 96 x 120 av format da-lite 7799.99,electronics - general,,27903,,da-plex base rear projection screen - 57 3 4 x 77 video format projection screens da-lite,,,,2608.99
2683,0,da-lite da-glas standard rear projection screen 72 x 96 video format 27639 4448.99,electronics - general,da-lite,,,da-plex base rear projection screen - 43 1 4 x 57 3 4 video format da-lite,projection screens,,,1669.99
532,0,iosafe rugged 750gb usb 3.0 portable external hard drive,hard drives,iosafe,pa70750u1yr,139.98,lacie starck 500 gb usb 2.0 portable external hard drive 301892,computers accessories,lacie,301892,
903,0,buffalo technology drivestation axis 1.5 tb usb 2.0 desktop external hard drive with buffalo tools and turbo pc hd-lb1 .5 tu2 black buffalo technology hd-lb1 .5 tu2 101.82,hard drives,,,,buffalo technology drivestation axis 1 tb usb 2.0 desktop external hard drive with buffalo tools and turbo pc hd-lb1 .0 tu2 black computers accessories buffalo technology hd-lb1 .0 tu2,,,,76.77
738,0,us brown bear desktop mount series double arm single monitor mount for 13 - 27 screens furniture 59.99,,us brown bear,,,dm2-b27-slvr double arm dual monitor desktop mount for 13 -27 screens w clamp silver dm2-b27-slvr,tv mounts,u.s. brown bear,,119.99
3284,0,bell o high-speed hdmi cable with ethernet 2-meter 69.99,tv accessories,bell ' o,hd7102,,ge 87708 high-speed hdmi cable with ethernet and swivel connector 6-feet 17.48,hdmi cables,general electric,87708,
4226,0,lorex simulated bullet style surveillance camera garden - general lorex,,,sg-610,12.84,lorex simulated professional outdoor surveillance camera sg630 21.84,simulated cameras,lorex,,
3409,0,transcend storejet 25d2 500gb external hard drive white ts500gsj25d2-w,hard drives,transcend,,70.88,transcend storejet m3 500 gb usb 3.0 external hard drive ts500gsj25m3 hard drive bags ts500gsj25m3 86.63,,transcend,,
3451,0,memorex color slim cd jewel cases - 100 pack electronics - general 3202-1990,,memorex,,29.88,memorex 32021926 clear slim jewel cases 25-pack disc jewel cases 32021926 7.2,,memorex,,
1798,0,elite m150xwv1 screens manual projection screen electronics - general,,elite screens,m150xwv1,187.84,elite screens manual pull down projection screen 16 9 aspect ratio-120in - black 157.12,projection screens,elite screens,m120uwh,
3929,0,edge tech diskgo 160gb portable usb hard drive hard drives edge tech pe222710 60.98,,,,,edge diskgo 500 gb 2.5-inch portable hard drive 78.07,external hard drives,edge,2.5 '' backup ultra portable hard drive,
1355,0,microsoft comfort optical mouse 3000 silver blue microsoft d1t00011,mice,,,19.95,microsoft comfort mouse 4500 sea blue 4fd-00012,keyboard mouse combos,microsoft,,20.17
5488,0,st. louis cardinals ipod touch 4g hard case electronics - general tribeca 29.99,,,fva4549,,oakland raiders ipod touch 4g hard case computers accessories 29.99,,tribeca,,
2549,0,d-link dir-412 mobile broadband wireless router dir412 119.99,networking,d-link,,,d-link dir-655 extreme n gigabit wireless router d-link dir-655,routers,,,
235,0,hon 10700 series right pedestal credenza 72w x 24d x 29-1 2h mahogany hon,furniture,,10707rnn,799.0,hon 10771nn - 10700 series desk 3 4-height double pedestals 60w x 30d x 29-1 2h mahogany hon,,,,
4943,0,canon powershot elph 100 hs blue 12.1 mp digital camera with 4x optical zoom 3.0 lcd 1080p hd video w 50 bonus prints digital cameras,,canon,4925b001aa,178.54,canon powershot g5 5mp digital camera w 4x optical zoom canon,point shoot digital cameras,,8398a001,
2614,0,sennheiser sh 350 ip binaural headset with noise canceling microphone,electronics - general,sennheiser,sh350ip,150.0,sennheiser pxc 250 active noise canceling headphones pxc250 127.99,audio video accessories,sennheiser,,
4189,0,filemate imagine series k2010 usb standard keyboard computers,,,,15.12,wintec filemate imagine series k2010 usb standard keyboard - luminous red 3fmnk2010urd-r keyboards wintec 15.99,,,3fmnk2010urd-r,
3143,0,imation 11864 slr-5 data cartridge 11864 55.92,mp3 accessories,imation,,,imation travan ns20 data cartridge 1-pack data cartridges imation ns20 47.72,,,,
3629,0,verbatim 4.7 gb 16x dvd-r whilte inkjet printable 50 packs spindle disc mp3 accessories verbatim 95079,,,,16.14,verbatim 97016 4.7 gb up to 16x datalifeplus white inkjet hub printable recordable disc dvd-r 100-disc spindle tape wrap dvd-r discs verbatim 30.72,,,97016,
4170,0,zotac geforce gt430 1gb ddr3 pci-express 2.0 graphics card zotac,electronics - general,,zt-40604-10l,88.88,evga geforce 8400 gs 1 gb ddr3 pci-express 2.0 graphics card 01g-p3-1302-lr,graphics cards,evga,01g-p3-1302-lr,38.99
1292,0,scosche 1993-up select subaru power 4-speaker connector car stereos su03b 9.88,,scosche,,,scosche fd16b power 4-speaker connector for 1998-up ford scosche,audio video accessories,,fd16b,8.12
5020,0,da-lite dual vision tensioned advantage deluxe electrol - hdtv format 92 diagonal electronics - general da-lite,,,88285,4242.99,hc da-mat tensioned advantage electrol - wide format size wide 94 diagonal projection screens da-lite,,,,
553,0,buffalo technology drivestation axis 1.5 tb usb 2.0 desktop external hard drive with buffalo tools and turbo pc hd-lb1 .5 tu2 black buffalo technology hd-lb1 .5 tu2 101.82,hard drives,,,,buffalo technology drivestation quad 8 tb 4 x 2 tb usb 3.0 external raid hard drive array hd-ql8tu3r5 black external hard drives 758.17,,buffalo technology,hd-ql8tu3r5,
1049,0,panasonic ergofit inner ear headphones white rp-hje450-w electronics - general rp-hje450-w,,panasonic,,43.88,panasonic rp-hje350-s slimz in-ear earbud headphones silver headphones panasonic rp-hje350-s,,,,21.91
5144,0,startech 2 port pci express superspeed usb 3.0 card adapter electronics - general pexusb3s2 39.98,,startech,,,port super speed usb 3.0 pci card computers accessories,,aluratek,aupc100f,29.99
2652,0,hp q6511a hp 11a toner 6000 page-yield black 191.03,printers,hp,q6511a,,oki 52117101 - 52117101 toner 33000 page-yield black,cables interconnects,oki,,
3077,0,dell switch by design studio lids big giant plaid 17r electronics - general 9vmv5 39.0,,dell,,,"dell switch by design studio lid for inspiron r series laptop - x switch by design studio , x - 17 ''",computers accessories,dell,,49.99
1369,0,targus sport notebook backpack computers,,targus,,29.97,dslr camera notebook backpack cases bags sumdex 59.78,,,njc-486bk,
4419,0,iogear 2-port miniview micro usb plus kvm switch iogear,networking,,gcs632uw6,37.57,iogear 2-port miniview micro ps 2 audio kvm switch with 2 cables gcs612a kvm switches 11.99,,iogear,gcs612a,
4809,0,panasonic stereo earbud headphones rp-hv21 green panasonic rphv21g,electronics - general,,,10.49,panasonic rp-hv152 portable earbud headphones with powerful sound headphones,,panasonic,rp-hv152-k,4.58
4409,0,luxor presentation station with laptop shelf luxor lp42cle-b 213.99,electronics - general,,,,luxor laptop overhead workstation with shelf luxor,television stands entertainment centers,,,
1678,0,snapshield p2 polycarbonate case ipad 2 smoke mp3 accessories scosche ipd2pcbk,,,,20.88,scosche snapshield p2 polycarbonate case ipad 2 - blue ipd2pcbl laptop netbook computer accessories ipd2pcbl,,scosche,,
3081,0,brother tn110bk black toner cartridge printers,,brother,tn110bk,49.88,brother black toner cartridge tn-210bk laser printer toner 48.99,,brother,tn-210bk,
3325,0,victor 1570-6 desktop two-color printing calculator stationery & office machinery victor,,,15706,199.88,sharp el-1192bl desktop 2 color printing calculator sharp 36.89,printing,,el-1192bl,
2661,0,da-lite dual vision tensioned cosmopolitan electrol - av format 10 x 10 diagonal,electronics - general,da-lite,84992,2735.99,da-lite 98811 pearlescent tensioned cosmopolitan electrol - av format 12 x 12 diagonal projection screens da-lite,,,,
4665,0,da-lite da-plex deluxe rear projection screen - 36 x 48 video format 27559,electronics - general,da-lite,,1630.99,da-lite 27639 da-glas standard rear projection screen 72 x 96 video format,projection screens,da-lite,,
3458,0,koss monaural headset with noise canceling microphone electronics - general cs-95,,koss,,11.88,sennheiser pc 151 binaural headset with noise-canceling microphone volume control sennheiser pc 151 42.52,headsets microphones,,,
4659,0,da-lite dual vision tensioned advantage deluxe electrol - hdtv format 92 diagonal electronics - general da-lite,,,88285,4242.99,da-lite 98811 pearlescent tensioned cosmopolitan electrol - av format 12 x 12 diagonal projection screens da-lite,,,,
4964,0,sony vf67cpam circular polarizing filter for 67mm dslr camera lens sony,camera and camcorder accessories,,vf67cpam,116.0,sony alpha circular pl filter for dslr lens diameter 62mm filters vf-62cpam 94.46,,sony,,
361,0,avery economy vinyl round ring view binder avery,stationery & office machinery,,5706,7.91,avery economy view binder with 1 inch round ring white 1 binder 5711 view binders avery 05711,,,,2.99
3050,0,pc treasures retractable mighty mini mouse navy 9.88,mice,pc treasures,07221,,pc treasures mighty mini mouse - retractable mice pc treasures 07220,,,,7.99
1199,0,epson t125420 yellow durabrite cartridge printers epson 11.88,,,t125420,,epson 78 yellow ink cartridge t078420 t078420 11.92,inkjet printer ink,epson,,
3775,0,vantec nexstar mx dual 3.5 dual bay external hard drive enclosure with jbod raid 0 1 nst-400mx-sr,electronics - general,vantec,,100.21,vantec nexstar tx 2.5-inch sata to usb 2.0 external hard drive enclosure nst-210s2-bk,hard drive enclosures,vantec,,9.77
2151,0,simplism silicone case set ipad brown trscipadbren,mp3 accessories,simplism,,33.0,simplism japan flip silicone case set for ipad 2 - pink tr-fscsipd2-pk en cases sleeves tr-fscsipd2-pk / en 34.99,,simplism japan,,
4515,0,epson t068120-d2 dual black ink cartridge printers epson epson t068120-d2,,,,39.84,epson t042320 magenta ink cartridge epson t042320,inkjet printer ink,,,11.2
4083,0,da-lite da-plex self trimming rear projection screen - 60 x 60 av format electronics - general 27575 2680.99,,da-lite,,,da-plex base rear projection screen - 40 1 4 x 53 3 4 video format projection screens da-lite 1525.99,,,,
695,0,gear head 2.4 ghz wireless optical nano mouse black gear head mp2800blk,mice,,,15.82,gear head 2.4 ghz wireless laser tilt-wheel mouse - stealth black lmt3600blk mice gear head,,,lmt3600blk,
1938,0,da-lite matte white deluxe model b manual screen - 60 x 80 video format electronics - general 188.99,,da-lite,74698,,da-lite deluxe model b silver matte - projection screen projection screens,,da-lite,silver matte,
4418,0,da-lite 40184 model b manual wall and ceiling projection screen 47.84,electronics - general,da-lite,40184,,da-lite deluxe model b manual wall and ceiling projection screen 60 x 60 85 diagonal high power surface projection screens 228.95,,da-lite,,
576,0,da-lite da-plex unframed rear projection screen - 84 x 84 av format 3561.99,electronics - general,da-lite,27503,,da-lite 27514 da-plex unframed rear projection screen - 108 x 144 video format projection screens,,da-lite,,
199,0,sylvania 4gb touch video mp3 player black smpk4230-black 35.0,mp3,sylvania,,,sylvania 2 gb clip mp3 player black curo7 12.99,mp3 players,,smp2200-black,
4076,0,microsoft lifecam hd-6000 usb hd webcam 7pd-00001 microsoft 36.97,electronics - general,,7pd-00001,,microsoft lifecam vx-6000 webcam gray laptop netbook computer accessories microsoft,,,68c-00001,40.0
2241,0,motorola h17 bluetooth headset 89334m,electronics - general,motorola,,38.84,bluetooth headset headsets microphones 89409n 23.99,,motorola,,
821,0,avery shipping labels with trueblock technology 2 x 4 white 1000 box 8463,stationery & office machinery,avery,,45.91,avery internet shipping labels for laser printers with trueblock technology 5.5 x 8.5 inches white box of 200 05126 shipping labels avery 5126 26.48,,,,
2691,0,verbatim 96438 2gb store n go usb 2.0 flash drive usb drives 96438 14.84,,verbatim,,,verbatim 96317 store n go usb flash drive 16 gb computer media usb storage media drives media storage organization verbatim,,,,29.93
1120,0,hp ce250a black toner cartridge ce250a,printers,hp,,187.04,brother black toner cartridge tn-210bk laser printer toner 48.99,,brother,tn-210bk,
2121,0,kodak easyshare m552 dark pink 14mp digital camera w 5x optical zoom 2.7 lcd display w 50 bonus prints kodak,digital cameras,,m552pink,94.54,kodak easyshare c183 14mp digital camera w 3x optical zoom 3.0 inch lcd black kodak 79.99,point shoot digital cameras,,,
5095,0,digital innovations clean dr. dvd laser lens cleaner digital innovations,electronics - general,,4190200,9.88,digital innovations skipdr 60120-00 laser lens cleaner digital innovations 7.81,cleaning repair,,60120-00,
4383,0,bell o high-speed hdmi cable with ethernet 1-meter tv accessories bell ' o 59.99,,,hd7101,,accell proultra supreme b116c-003b-40 high speed hdmi cable with ethernet 1m accell b116c-003b-40,hdmi cables,,,17.79
2810,0,da-lite da-view thru-the-wall rear projection screen - 58 x 104 hdtv format da-lite 22472.99,electronics - general,,23074,,da-lite da-view thru-the-wall rear projection screen - 50 1 2 x 67 1 4 video format projection screens da-lite 23034,,,,9739.76
3173,0,startech.com sat3510bu2v usb to sata external hard drive enclosure 28.88,electronics - general,startech,sat3510bu2v,,startech.com esata usb to sata external hard drive docking station for 2.5 or 3.5-inch satadocku2e - black startech satadocku2e 26.99,computers accessories,,,
183,0,da-lite dual vision tensioned cosmopolitan electrol - av format 10 x 10 diagonal,electronics - general,da-lite,84992,2735.99,hc cinema perf tensioned cosmopolitan electrol - wide format size wide 94 diagonal,projection screens,da-lite,,
56,0,smead acid-free poly folder 2 fasteners 1 3 cut top tab letter manila 24 box stationery & office machinery 10545 42.94,,,,,smead 17940 - folders two fasteners 1 3 cut assorted top tab legal yellow 50 box 92.53,cables interconnects,smead,,
1791,0,razer lachesis gaming mouse mice razer rz01-00170500-r3u1 77.5,,,,,razer naga epic gaming mouse,gaming mice,razer,rz01-00510100-r3u1,109.87
6002,0,coby purple high-performance isolation stereo earphones cvem79pur electronics - general coby cvem79pur,,,,8.54,coby jammerz high-performance isolation stereo earphones cve52svr silver headphones coby cv-e52 svr 4.46,,,,
5058,0,panasonic kx-tga6645b dect 6.0 plus expandable digital cordless answering system with 5 handsets electronics - general panasonic,,,kx-tg6645b,150.0,panasonic kx-tg4133n dect 6.0 cordless phone with answering system champagne gold 3 handsets cordless telephones panasonic,,,kx-tg4133n,83.23
967,0,crown ecoplus mat 4 x 6 charcoal home care ecr046ch 144.97,,crown,,,crown ecr310ch - ecoplus mat 3 x 10 charcoal crown,antitheft,,,
412,0,belkin 12 y audio cable belkin f8v235-12,electronics - general,,,4.87,belkin f8v203-12 12-foot mini-stereo audio cable 3.99,computers accessories,belkin,f8v203-12,
344,0,buffalo technology linkstation duo 1 tb 2 x 500 gb network attached storage ls-wx1 .0 tl r1 buffalo technology lswx10tlr1,networking,,,192.63,buffalo technology linkstation duo 4 tb 2 x 2 tb network attached storage ls-wx4 .0 tl r1 computers accessories buffalo technology ls-wx4 .0 tl/r1 298.99,,,,
2776,0,jvc haebx85p sports ear-clip headphones - pink electronics - general jvc 14.54,,,haebx85p,,jvc haebx5d inner ear sports clip headphones orange headphones jvc haebx5d,,,,13.88
1150,0,case logic trend compact camera case,mp3 accessories,case logic,214336,15.19,case logic slmc-200 compact systems camera case black cases bags,,case logic,slmc-200,18.75
1867,0,buffalo technology drivestation axis 1.5 tb usb 2.0 desktop external hard drive with buffalo tools and turbo pc hd-lb1 .5 tu2 black buffalo technology hd-lb1 .5 tu2 101.82,hard drives,,,,buffalo drivestation juststore 1 tb usb 2.0 external hard drive hd-cl1 .0 tu2n black buffalo technology 60.24,external hard drives,,hd-cl1 .0 tu2n,
3854,0,da-lite video spectra 1.5 model b manual screen with csr - 69 x 92 video format da-lite 85322 429.99,electronics - general,,,,da-lite advantage manual with csr - projection screen - 133 in - 16 9 - video spectra 1.5 home audio theater 789.95,,da-lite,,
3487,0,sennheiser sh 230 monaural headset 84.0,electronics - general,sennheiser,sh230,,sennheiser sh 350 binaural headset with microphone accessories supplies sennheiser sh 350,,,,90.7
4302,0,da-lite da-plex deluxe rear projection screen - 36 x 48 video format 27559,electronics - general,da-lite,,1630.99,da-lite deluxe model b video spectra 1.5 - projection screen - 92 in projection screens,,da-lite,video spectra 1.5,194.95
5104,0,da-lite high contrast matte white model b manual screen - 60 x 60 av format electronics - general da-lite,,,93154,92.99,da-lite deluxe model b - projection screen - 72 in - 4 3 - high contrast matte white projection screens da-lite,,,,
