id,label,left_title,left_category,left_brand,left_modelno,left_price,right_title,right_category,right_brand,right_modelno,right_price
2194,0,da-lite da-glas deluxe rear projection screen - 40 1 4 x 53 3 4 video format da-lite 27655 1752.99,electronics - general,,,,da-lite da-view thru-the-wall rear projection screen - 45 x 80 hdtv format,projection screens,da-lite,23065,12909.87
2816,0,green onions supply 10.1 anti-glare screen protector green onions supply rt-spfg101w / m,electronics - general,,,22.88,green onions supply rt-spf10141w m anti-glare screen protector for 14.1-inch laptop lcd screen -1 piece transparent green rt-spf10141w / m 29.88,bags cases,,,
1308,0,avery matte white cd labels for color laser printers and copiers 30 disc labels and 60 spine labels,stationery & office machinery,avery,6692,14.88,avery cd dvd labels matte white 40 disc labels and 80 spine labels 8692 avery 8692,labels stickers,,,14.12
904,0,rayovac alkaline 9 volt batteries 6ct electronics - general rayovac a1604-6ctd 9.97,,,,,rayovac al9v-8 ultrapro alkaline 9v batteries 8-pack 9v rayovac al9v-8 11.89,,,,
322,0,da-lite da-plex deluxe rear projection screen - 50 1 2 x 67 1 4 video format da-lite,electronics - general,,27562,2544.99,da-lite 27639 da-glas standard rear projection screen 72 x 96 video format,projection screens,da-lite,,
590,0,brother tn360 black toner cartridge brother tn360,printers,,,45.54,black toner cartridge 15k yld konica-minolta 152.29,,,4563301,
3568,0,dymo d1 standard tape cartridge for dymo label makers 3 8in x 23ft red on white,stationery & office machinery,dymo,45018,17.47,dymo d1 tape cartridge for electronic label makers 1 2w blue on clear labeling tapes 19.21,,dymo,,
84,0,xfx radeon hd6850 pcie 1gb ddr5 graphics card 195.0,electronics - general,xfx,hd685xzndc,,xfx hd 6850 775m 1 gb ddr5 graphics card hd685xznfc graphics cards,,xfx,hd685xznfc,163.99
585,0,edge 8gb diskgo usb 2.0 flash drive silver usb drives pe204198,,edge,,10.98,edge diskgo secure guardian flash drive - usb flash drive - 32 gb - usb 2.0 edge diskgo secure guardian flash drive 78.05,computer components,,,
1410,0,edge 16gb proshot 133x cf memory card usb drives edge tech 39.98,,,pe222031,,4gb edge proshot sdhc memory card class6 computers accessories 17.83,,edge,,
5198,0,epson t020201 color ink cartridge epson t020201 27.0,printers,,,,epson t008201 color inkjet cartridge inkjet printer ink,,epson,t008201,18.18
1137,0,da-lite da-plex self trimming rear projection screen - 40 1 4 x 53 3 4 video format 27580 1892.99,electronics - general,da-lite,,,da-lite data pro thru-the-wall rear projection screen - 52 x 92 hdtv format da-lite 15985.81,projection screens,,23181,
3648,0,samsung s2 640gb usb 3.0 portable external hard drive red,hard drives,samsung,hx-mta64da / g42,78.88,seagate expansion 500 gb usb 2.0 portable external hard drive st905004exa101-rk external hard drives st905004exa101-rk,,seagate,,49.99
4852,0,xtrememac incharge mobile case for iphone 4 memorex ippim411 79.99,electronics - general,,,,xtrememac ipu-ica-13 incharge auto for iphone ipod chargers xtrememac 10.71,,,ipu-ica-13,
746,0,incipio smart feather for apple ipad 2 light blue electronics - general,,incipio,ipad-227,33.25,incipio smart feather case for apple ipad 2 - pink ipad-230 incipio 25.02,cases sleeves,,ipad-230,
1304,0,da-lite da-plex deluxe rear projection screen - 78 x 139 hdtv format da-lite 7452.99,electronics - general,,27573,,da-lite holo screen - projection screen rear video projectors da-lite,,,,
1656,0,da-lite da-plex self trimming rear projection screen - 96 x 120 av format da-lite 7799.99,electronics - general,,27903,,da-lite da-plex thru-the-wall rear projection screen - 78 x 139 hdtv format projection screens da-lite,,,23077,9258.99
2554,0,elite screens cinewhite cinema235 series fixed frame wide screen - 85 diagonal electronics - general elite screens r85wh1-wide 409.0,,,,,powergain prime vision series fixed frame screen - 135 diagonal projection screens elite 1069.0,,,,
3552,0,genius agama m-300 retractable mini mouse - optical - usb - black mice genius 31010615100 10.0,,,,,targus ultra mini optical mouse with retractable cord - mouse - optical - wired - usb - silver targus with retractable cord 25.92,mice,,,
547,0,boise aspen 30 office paper 92 brightness 20lb 8-1 2 x 14 5000 sheets carton stationery & office machinery 52.54,,,54901,,wausau paper 32519 - exact eco 100 paper 92 brightness 20lb 8-1 2 x 14 white 500 sheets ream wausau 34.22,,,,
881,0,comprehensive 25-pin male connector with hood set of 25 tv accessories 69.0,,comprehensive,db25m,,comprehensive rj45p rj45 male connector - 8 position 8 conductor set of 25 comprehensive,,,,
2628,0,brother tn110bk black toner cartridge printers,,brother,tn110bk,49.88,brother tn-620 toner cartridge laser printer toner brother tn620 47.99,,,,
3171,0,kodak easyshare m531 red 14mp digital camera w 3x optical zoom 2.7 lcd display w 50 bonus prints digital cameras m531 red,,kodak,,89.0,kodak easyshare m552 14 mp digital camera with 5x optical zoom and 2.7-inch lcd - black new model point shoot digital cameras kodak,,,1836824,
3127,0,panasonic kx-tg4022n dect 6.0 plus expandable cordless answering system w 2 handsets panasonic kx-tg4022n 44.98,electronics - general,,,,panasonic kx-tg6512b dect 6.0 plus expandable digital cordless phone system black 2 handsets panasonic 44.99,cordless telephones,,kx-tg6512b,
3153,0,da-lite da-tex rear tensioned advantage electrol - av format 8 x 8 diagonal electronics - general,,da-lite,85375,2549.38,da-lite 98810 hc da-mat tensioned cosmopolitan electrol - av format 12 x 12 diagonal projection screens,,da-lite,,
739,0,cobra highgear noise-canceling external speaker stereos/audio 17.03,,cobra,hg-s300,,cobra hg s500 highgear cb speaker cobra 19.68,speakers,,hg-s500,
4060,0,imation 16gb pocket flash drive 27861,usb drives,imation,,58.88,imation clip 4 gb usb 2.0 flash drive imation 26309,usb flash drives,,,19.42
2147,0,chicago cubs pink iphone 4 hard case electronics - general tribeca,,,fva4424,29.99,new york yankees pink iphone 4 hard case computers accessories,,tribeca,,23.99
28,0,da-lite da-plex deluxe rear projection screen - 36 x 48 video format 27559,electronics - general,da-lite,,1630.99,da-glas base rear projection screen - 43 1 4 x 57 3 4 video format 1519.99,projection screens,da-lite,,
5183,0,sharpie retractable permanent markers fine point assorted 3pk,stationery & office machinery,sharpie,32726pp,8.18,sharpie 32001 - twin-tip permanent marker fine ultra fine point black sharpie 20.85,home security systems,,,
4493,0,da-lite hc cinema vision tensioned cosmopolitan electrol - av format 7 x 9 diagonal da-lite 89892 2240.0,electronics - general,,,,hc cinema perf tensioned advantage electrol - wide format size wide 94 diagonal projection screens da-lite,,,,
5629,0,da-lite matte white deluxe model b manual screen - 60 x 80 video format electronics - general 188.99,,da-lite,74698,,da-lite deluxe model b high contrast matte white - projection screen projection screens 125.95,,da-lite,high contrast matte white,
5386,0,san diego padres iphone 4 case silicone cover,electronics - general,tribeca,fva3959,24.99,michigan wolverines iphone 4 case silicone cover computers accessories,,tribeca,,17.99
1628,0,d-link dgs-1005g 5-port gigabit desktop switch,networking,d-link,dgs1005g,27.88,d-link des-1105 5-port 10 100 desktop switch d-link des-1105,switches,,,14.09
726,0,da-lite da-glas unframed rear projection screen - 57 3 4 x 77 video format da-lite 27604 1609.99,electronics - general,,,,da-lite da-view thru-the-wall rear projection screen - 50 1 2 x 67 1 4 video format projection screens da-lite 23034,,,,9739.76
5172,0,da-lite da-plex self trimming rear projection screen - 96 x 120 av format da-lite 7799.99,electronics - general,,27903,,da-plex base rear projection screen - 40 1 4 x 53 3 4 video format projection screens da-lite 1525.99,,,,
4008,0,msi n570gtx graphics card msi 393.99,electronics - general,,n570gtxm2d12d5o,,msi n570gtx twin frozr iii power edition oc graphics card msi n570gtx twin frozr iii power edition/oc 369.99,graphics cards,,,
4075,0,kingston kvr800d2n5 1g valueram 1gb ddr2-800 240-pin sdram desktop memory module memory kvr800d2n5/1g,,kingston,,20.92,kingston 1gb ddr2 667mhz 240-pin ram memory for dell desktop pc,,kingston,,
705,0,iosafe rugged 500gb usb 3.0 portable external hard drive hard drives,,iosafe,pa50500u5yr,299.98,verbatim acclaim 500 gb usb 2.0 portable external hard drive 97165 piano black verbatim 97165,,,,69.24
311,0,seagate blackarmor nas 440 is a 4tb network attached storage server 599.0,networking,seagate,,,seagate blackarmor nas 420 4 - bay 2 tb 2 x 1 tb and 2 empty bays network attached storage st320005sha10g-rk,network attached storage,seagate,st320005sha10g-rk,546.02
423,0,bower ss2477 digital wrist strap grey camera and camcorder accessories relaunch ss2477g,,bower,,7.98,bower ss26 digital neck strap green atlona ss26gr 12.19,audio video accessories,,,
4460,0,panasonic kx-tga6645b dect 6.0 plus expandable digital cordless answering system with 5 handsets electronics - general panasonic,,,kx-tg6645b,150.0,panasonic kx-tg6632b dect 6.0 cordless phone with answering system black 2 handsets cordless telephones panasonic,,,kx-tg6632b,72.87
3572,0,da-lite da-plex deluxe rear projection screen - 50 1 2 x 67 1 4 video format da-lite,electronics - general,,27562,2544.99,da-plex base rear projection screen - 57 3 4 x 77 video format projection screens da-lite,,,,2608.99
4529,0,case logic 72 capacity heavy duty cd wallet electronics - general,,case logic,59253,15.99,case logic cdw-320 320 capacity nylon cd wallet black 28.99,media storage organization,case logic,cdw-320,
4894,0,startech.com dvidsmm20 20ft dvi-d digital video cable startech dvidsmm20 27.88,electronics - general,,,,startech.com hdmimm10 10 feet hdmi to hdmi digital video cable,hdmi cables,startech,hdmimm10,11.95
5766,0,seagate blackarmor nas 440 is a 4tb network attached storage server 599.0,networking,seagate,,,seagate blackarmor nas 220 2-bay 2 tb 2 x 1 tb network attached storage st320005lsa10g-rk,network attached storage,seagate,st320005lsa10g-rk,199.99
3830,0,v7 5 cat6 snagless molded network patch cable red,electronics - general,v7,v7n2c6-05f-reds,4.88,v7 cat5e snagless molded network patch cable rj45 male to male blue 3-feet v7n3c5e-03f-blus v7 v7n3c5e-03f-blus 1.43,ethernet cables,,,
3519,0,sabrent usb 2.0 wireless 802.11 g adapter networking sabrent 24.88,,,nt-wghu,,sabrent wireless lan 802.11 n pci network 300 mps wi-fi card adapter computers accessories,,sabrent,pci-802n,8.31
4031,0,hp q2429a maintenance kit printers hp q2429a,,,,234.54,108r00675 maintenance kit computers accessories 143.44,,xerox,,
2754,0,seagate freeagent goflex 500gb usb 2.0 ultra-portable hard drive black seagate 9zf2a2-570,hard drives,,,71.07,seagate freeagent goflex desk 2 tb usb 2.0 external hard drive stac2000100 black,external hard drives,seagate,stac2000100,
1407,0,seagate blackarmor nas 440 is a 4tb network attached storage server 599.0,networking,seagate,,,seagate blackarmor nas 110 2 tb network attached storage st320005mna10g-rk seagate 149.99,computers accessories,,st320005mna10g-rk,
3633,0,hp ce278a black laserjet print cartridge hp 69.84,printers,,hp ce278a,,hp laserjet 96a black print cartridge in retail packaging laser printer toner c4096a,,hp,,75.0
1784,0,ifrogz backbone case for ipad 2 black mp3 accessories ifrogz 34.99,,,ipad2bakblk,,ifrogz ipad 2 backbone case - clear ipad2-bak-clr cases sleeves ifrogz,,,ipad2-bak-clr,34.14
5942,0,hp ce278a black laserjet print cartridge hp 69.84,printers,,hp ce278a,,cs hp ce250x black toner cartridge hp color laserjet cm3530 concord,printer ink toner,,,
1630,0,da-lite da-view thru-the-wall rear projection screen - 60 x 80 video format 23046 13997.99,electronics - general,da-lite,,,da-plex deluxe rear projection screen - 108 x 108 av format,projection screens,da-lite,,7950.0
2908,0,innovera heavyweight photo paper matte 8-1 2 x 11 50 sheets pack stationery & office machinery innovera 11.7,,,99650,,innovera 99450 - glossy photo paper 8-1 2 x 11 50 sheets pack hard drive bags,,innovera,,
1471,0,logitech wireless mouse dark fleur 910001898,mice,logitech,,27.82,logitech wireless anywhere mouse mx for pc and mac mice logitech,,,910-001637,44.99
1445,0,siig 1m mini displayport to display port adapter cable electronics - general 12.88,,siig,cb-dp0d11-s1,,syba high quality mini displayport to hdmi adapter syba sy-ada33005 7.14,hdmi cables,,,
264,0,olympus vg-110 silver 12mp digital camera bundle w 4x optical zoom 2.7 lcd display hd movie recording olympus 228175 kit 139.0,digital cameras,,,,olympus t-100 12mp digital camera with 3x optical zoom and 2.4 inch lcd silver point shoot digital cameras olympus t100 silver 64.95,,,,
5002,0,kodak easyshare m552 dark pink 14mp digital camera w 5x optical zoom 2.7 lcd display w 50 bonus prints kodak,digital cameras,,m552pink,94.54,kodak easyshare m532 14 mp digital camera with 4x optical zoom and 2.7-inch lcd - red new model point shoot digital cameras 1689868,,kodak,,89.0
494,0,case logic 16 laptop backpack 154710 39.99,electronics - general,case logic,,,case logic dlbp-114 14-inch laptop backpack black case logic,bags cases,,dlbp-114black,41.86
3295,0,audiosource bi8 8 in-wall construction bracket mount 25.88,furniture,audiosource,bi8,,audiosource bi5 5.25 in-wall construction bracket mount,printers,grade-a,,
369,0,coolmax 3.5 usb 3.0 external hard drive enclosure black electronics - general 26.88,,coolmax,hd-381bz-u3,,vantec nexstar sx nst-285u2-bk 2.5-inch ide to usb 2.0 external hard drive enclosure onyx black black hard drive enclosures vantec,,,nst-285u2-bk,14.99
1336,0,brother dk2113 ql label printers continuous length tape stationery & office machinery dk2113,,brother,,64.88,brother dk-2212 continuous length film label roll 2-3 7 wide 34.99,labeling tapes,brother,dk-2212,
4495,0,da-lite high power model c manual screen - 8 x 10 av format da-lite 797.99,electronics - general,,83207,,video spectra 1.5 model c manual screen - av format - 6 x8 - 8 x10 size 6 x 8 projection screens 293.95,,da-lite,,
1610,0,v7 5 cat6 snagless molded network patch cable red,electronics - general,v7,v7n2c6-05f-reds,4.88,v7 cat5e snagless molded network patch cable rj45 male to male blue 1-foot v7n3c5e-01f-blus ethernet cables 1.19,,v7,v7n3c5e-01f-blus,
3898,0,iosafe solopro 1tb usb 3.0 external hard drive hard drives iosafe 248.0,,,sj1000gb1yr,,iosafe rugged portable 250 gb usb 3.0 external hard drive pa50250u1yr external hard drives iosafe,,,pa50250u1yr,145.99
2082,0,3m dry-erase board porcelain 6 x4 aluminum frame stationery & office machinery 3m 579.29,,,,,3m m7248a - melamine dry erase board 72 x 48 aluminum frame 3m,,,,
4255,0,da-lite da-plex deluxe rear projection screen - 36 x 48 video format 27559,electronics - general,da-lite,,1630.99,da-lite 27651 da-glas deluxe rear projection screen - 96 x 96 av format,projection screens,da-lite,,
1412,0,panasonic kx-tg4022n dect 6.0 plus expandable cordless answering system w 2 handsets panasonic kx-tg4022n 44.98,electronics - general,,,,panasonic kx-tg6445t dect 6.0 cordless phone with answering system metallic black 5 handsets kx-tg6445t 108.84,cordless telephones,panasonic,,
5110,0,cables unlimited 15 usb 2.0 a to b cable clear electronics - general cables unlimited usb-5010-05m 8.88,,,,,cables unlimited usb-5020-03m 3-meter usb 2.0 black a to b cable,usb cables,cables unlimited,usb-5020-3m,1.89
1294,0,comprehensive high density15-pin vga male metal connector with hood set of 25 comprehensive 69.0,tv accessories,,hd15p,,comprehensive rj45p rj45 male connector - 8 position 8 conductor set of 25 comprehensive,,,,
483,0,da-lite da-glas standard rear projection screen 72 x 96 video format 27639 4448.99,electronics - general,da-lite,,,da-lite da-plex thru-the-wall rear projection screen - 72 x 96 video format projection screens da-lite 10252.0,,,23049,
5893,0,da-lite da-plex standard rear projection screen - 60 x 80 video format electronics - general da-lite 27544 2931.99,,,,,da-lite 27912 da-glas unframed rear projection screen - 96 x 120 av format projection screens,,da-lite,,
493,0,western digital 2tb my book studio edition ii external hard drive computers wdh2q20000n 199.0,,western digital,,,western digital my book studio ii - 4 tb 2 x 2 tb usb 2.0 firewire 800 400 esata desktop external hard drive external hard drives wdh2q40000n 305.97,,western digital,,
2473,0,zax pro series subwoofer cable 4m 6.88,electronics - general,zax,87704,,zax 87510 pro series rca audio cable 10 m,computers accessories,zax,,
304,0,jvc lightweight folding headphones with bass boost black electronics - general jvc,,,has600b,49.95,jvc has150px light weight flat folding headphone pink,headphones,jvc,has150px,14.3
625,0,western digital wd scorpio blue 320gb 5400rpm 2.5 sata hard drive wdbabc3200anc hard drives western digital wdbabc3200anc,,,,51.12,western digital 320 gb scorpio black sata 7200 rpm 16 mb cache bulk oem notebook hard drive wd3200bekt computers accessories western digital wd3200bekt,,,,54.99
1550,0,case logic trend compact camera case,mp3 accessories,case logic,214336,15.19,case logic tbc-302 ultra compact camera case with storage magenta cases bags tbc302magenta,,case logic,,6.0
2675,0,sandisk 8gb cruzer usb flash drive pink usb drives 12.88,,sandisk,sdcz36z008gaw11p,,sandisk cruzer blade usb flash drive 4gb sdcz50-004g-p95 sandisk sdcz50-004g,usb flash drives,,,7.86
3258,0,kingston ktd-dm8400a 1g 1gb ddr2 sdram memory module kingston ktd-dm8400a / 1g 22.92,memory,,,,kingston 2 gb ddr2 sdram memory module 2 gb 1 x 2 gb 667mhz ddr2 sdram kfj-fpc218 2g memory kfj-fpc218 / 2g 24.99,,kingston,,
3133,0,startech 2.5 in superspeed usb 3.0 sata hard drive enclosure sat2510bu3 electronics - general startech sat2510bu3,,,,27.98,siig superspeed usb 3.0 to sata 2.5 enclosure ju-sa0912-s1 cables interconnects siig,,,ju-sa0912-s1,19.53
4178,0,da-lite da-plex base rear projection screen - 57 3 4 x 77 video format da-lite 2608.99,electronics - general,,27528,,da-lite holo screen - projection screen rear video projectors da-lite,,,,
976,0,vantec 3.5 ide to usb 2.0 nexstar 3 hard drive enclosure onyx black nst-360u2-bk 30.23,electronics - general,vantec,,,vantec nexstar 3 nst-360su-bk 3.5-inch sata to usb 2.0 and esata external hard drive enclosure onyx black hard drive enclosures nst-360su-bk,,vantec,,28.99
5025,0,da-lite tilt lock single pair or container of 12 pairs da-lite 66.19,electronics - general,,40964,,t-bar clips single pair or container of 12 pairs color black package one pair of clips projection screens,,da-lite,,9.99
498,0,da-lite da-plex deluxe rear projection screen - 50 1 2 x 67 1 4 video format da-lite,electronics - general,,27562,2544.99,da-lite 27565 da-plex deluxe rear projection screen - 72 x 96 video format,,da-lite,,
1567,0,western digital av-gp 320gb sata desktop internal hard drive wd3200avvs,hard drives,western digital,,51.7,western digital 160gb eide internal hard drive with 8mb cache,,western digital,wd1600jbrtl,
5315,0,da-lite matte white designer model b with fabric case in fawn - 70 x 70 av format da-lite 73113,electronics - general,,,152.99,video spectra 1.5 designer model b with fabric case in pepper - av format size 50 x 50 projection screens da-lite,,,,
1600,0,verbatim 96438 2gb store n go usb 2.0 flash drive usb drives 96438 14.84,,verbatim,,,verbatim tuff n tiny 8 gb usb 2.0 flash drive 96816 purple 96816,usb flash drives,verbatim,,18.85
4517,0,buffalo technology 2tb usb 3.0 drivestation duo hard drives hdwl2tu3r1,,buffalo technology,,239.82,buffalo technology drivestation datavault 1.5 tb usb 2.0 desktop external hard drive hd-cxt1 .5 tu2 black hd-cxt1 .5 tu2,external hard drives,buffalo technology,,109.99
5952,0,adobe creative suite v. 5.0 design premium upgrade version windows adobe,software,,65065612,578.54,adobe creative suite premium 2.3 win old version photo video design adobe 28040500,,,,
5577,0,hp 80 ink printhead printhead cleaner black c4890a 268.79,stationery & office machinery,hp,c4890a,,hp c4893a - c4893a hp 80 ink printhead printhead cleaner 4400 page-yield yellow 268.78,distribution,hp,,
2803,0,philips 3 high speed hdmi cable electronics - general philips 10.43,,,swv3431w/17,,bell o hd7104 high speed hdmi cables bell ' o hd7104,hdmi cables,,,61.54
4934,0,da-lite da-glas standard rear projection screen 81 x 108 video format da-lite 27917 5391.99,electronics - general,,,,da-glas base rear projection screen - 43 1 4 x 57 3 4 video format 1519.99,projection screens,da-lite,,
1826,0,da-lite hc cinema vision tensioned cosmopolitan electrol - av format 7 x 9 diagonal da-lite 89892 2240.0,electronics - general,,,,da-lite 97974 hc cinema vision tensioned cosmopolitan electrol - video format 210 diagonal da-lite,,,,
288,0,da-lite medium oak veneer model b manual screen with matte white fabric - 60 x 60 diagonal video format da-lite 73171,electronics - general,,,167.99,light oak veneer model b manual screen with matte white fabric - diagonal video format size 60 x 60 diagonal projection screens da-lite,,,,
1997,0,chicago white sox pink iphone 4 hard case electronics - general tribeca 29.99,,,fva4556,,chicago cubs pink iphone 4 hard case computers accessories 23.99,,tribeca,,
3242,0,da-lite da-mat tensioned advantage electrol - av format 60 x 60 da-lite 84367 2022.99,electronics - general,,,,hc da-mat tensioned advantage deluxe electrol - hdtv format size 92 diagonal da-lite 3740.0,projection screens,,,
4299,0,startech.com sat3510bu2v usb to sata external hard drive enclosure 28.88,electronics - general,startech,sat3510bu2v,,startech.com 3.5-inch black usb 2.0 to ide sata external hard drive enclosure uni3510u2 startech,,,uni3510u2,27.99
4382,0,da-lite da-plex self trimming rear projection screen - 40 1 4 x 53 3 4 video format 27580 1892.99,electronics - general,da-lite,,,da-lite 27912 da-glas unframed rear projection screen - 96 x 120 av format projection screens,,da-lite,,
2303,0,kodak easyshare c195 red 14.0 mp digital camera w bonus case bundle 5x optical zoom 3.0 lcd smart capture w 50 bonus prints digital cameras,,kodak,c195 red bndle,79.0,kodak easyshare c143 12 mp digital camera with 3x optical zoom blue bundle 62.68,point shoot digital cameras,kodak,c143 blue,
3150,0,sentry headart extreme folding headphones black mp3 accessories sentry sentry dj style bk,,,,12.98,sentry headart extreme folding headphones silver headphones 15.99,,sentry,,
2618,0,lexmark pinnacle pro901 wireless-n all-in-one printer scanner copier fax printers lexmark,,,lexmark pro901,199.99,hp laserjet 3055 all-in-one printer copier scanner fax white laser jet 3055,all-in-one printers,hp,,
2689,0,centon 16gb datastick pro usb flash drive 2-pack bundle computers 42.0,,,,,centon 16 gb datastick pro usb 2.0 flash drive dsp16gb-009 computer components dsp16gb-009 21.4,,centon,,
1325,0,netgear prosafe plus 8-port ethernet switch networking netgear gs108e100nas,,,,78.88,netgear fs524 24-port 10 100 rackmount ethernet switch switches fs524,,netgear,,
2721,0,lexmark x651h11a high-yield toner 25000 page-yield black 565.2,printers,lexmark,x651h11a,,lexmark 12035sa - 12035sa toner 2000 page-yield black computers accessories 117.77,,lexmark,,
5496,0,rayovac 6v rechargeable battery electronics - general rayovac,,,rvla,0.0,motorola nicd rechargeable battery motorola 53615 11.45,accessories,,,
2268,0,innovera softskin gel keyboard wrist rest black electronics - general 11.88,,innovera,51451,,innovera softskin gel wrist rest black wrist rests innovera 13.17,,,,
5335,0,q-see professional indoor dome camera qsd360 garden - general q-see qsd360,,,,99.82,q-see qsdnv indoor dome cmos camera w night vision color dome cameras,,q-see,qsdnv,46.99
1519,0,panasonic kx-tg4022n dect 6.0 plus expandable cordless answering system w 2 handsets panasonic kx-tg4022n 44.98,electronics - general,,,,panasonic dect 6.0 expandable digital cordless phone with talking caller id answering system - 2 handset pack,,panasonic,,91.41
3794,0,dell switch by design studio lids shaadi 15r electronics - general dell 39.0,,,yxmrf,,dell switch by design studio lid for inspiron r series laptop - sangeet dell 49.99,computers accessories,,"switch by design studio , sangeet - 17 ''",
3875,0,logitech wireless mouse m310 bundle computers,,,,29.88,logitech wireless mouse m310 indigo scroll 910-002482 mice logitech 910-002482,,,,20.05
3585,0,startech 3 slim 3.5 mm right angle stereo audio cable m m startech mu3mms2ra 7.88,electronics - general,,,,startech.com mu3mmsra slim 3.5 mm to right angle stereo audio cable - m m 3 feet mu3mmsra,connectors adapters,startech,,3.48
213,0,da-lite da-plex thru-the-wall rear projection screen - 78 x 139 hdtv format 23077,electronics - general,da-lite,,11385.99,da-lite da-view thru-the-wall rear projection screen - 50 1 2 x 67 1 4 video format projection screens da-lite 23034,,,,9739.76
1812,0,sony xplod cdx-gt35uw car cd receiver car stereos sony,,,cdx-gt35uw,95.0,sony cdxgt350mp mp3 wma cd receiver cd-mp3 players 69.72,,sony,cdxgt350mp,
2017,0,cables unlimited 3 high-speed hdmi cable black tv accessories cables unlimited pcm-2295-03,,,,10.88,cables unlimited retractable usb 2.0 mini5 pin cable black zip-usb2-c05,data cables,cables unlimited,,
5627,0,targus 13.3 widescreen lcd monitor privacy screen asf133w9usz 42.07,electronics - general,targus,,,lcd monitor privacy screen filter compucessory,audio video accessories,,,48.94
1513,0,da-lite video spectra 1.5 deluxe model b manual screen - 50 x 67 video format 73639 181.99,electronics - general,da-lite,,,da-lite model b with csr - projection screen - 1 1 - video spectra 1.5 da-lite,projection screens,,,284.5
2190,0,case logic high zoom camera case mp3 accessories 152256 17.59,,case logic,,,case logic dcb-66 high zoom camera case black case logic 25.99,cases bags,,dcb-66,
